{
  "title": "HQE Patch Action",
  "type": "object",
  "properties": {
    "finding_id": {
      "type": "string"
    },
    "files": {
      "type": "array",
      "items": {
        "type": "string"
      }
    },
    "exact_intended_change": {
      "type": "string"
    },
    "patch": {
      "type": "string"
    },
    "validation": {
      "type": "array",
      "items": {
        "type": "string"
      }
    },
    "expected_result": {
      "type": "string"
    },
    "rollback": {
      "type": "array",
      "items": {
        "type": "string"
      }
    }
  },
  "required": [
    "finding_id",
    "files",
    "exact_intended_change",
    "patch"
  ],
  "additionalProperties": false,
  "$schema": "http://json-schema.org/draft-07/schema#"
}
